{
  "$schema": "https://json-schema.org/draft/2020-12/schema",
  "title": "PresentationKit deck manifest",
  "type": "object",
  "required": ["metadata", "slides"],
  "properties": {
    "$schema": { "type": "string" },
    "metadata": {
      "type": "object",
      "required": ["title"],
      "properties": {
        "title": { "type": "string", "minLength": 1 },
        "subject": { "type": "string" },
        "author": { "type": "string" },
        "company": { "type": "string" },
        "language": { "type": "string" },
        "footer": { "type": "string" },
        "intent": {
          "type": "string",
          "description": "Recommended presentation intent id. Unknown values are runtime warnings so teams can add custom intent catalogs."
        }
      },
      "additionalProperties": true
    },
    "theme": {
      "type": "object",
      "additionalProperties": true
    },
    "brandPack": {
      "type": "object",
      "description": "Optional handoff metadata for an authorized external brand-specific PPTX companion workflow. Do not embed private brand assets in this manifest.",
      "properties": {
        "kind": {
          "type": "string",
          "enum": ["presentation-brand-pack"],
          "description": "Generic contract marker for external companion skill folders that expose a presentation brand pack."
        },
        "id": { "type": "string" },
        "companionSkill": { "type": "string" },
        "brandPackManifest": {
          "type": "string",
          "description": "Optional path to the companion skill brand-pack.json. When omitted, agents should look for brand-pack.json in the companionSkill folder."
        },
        "templateReference": { "type": "string" },
        "templatePath": { "type": "string" },
        "slideSize": {
          "type": "object",
          "properties": {
            "width": { "type": "number" },
            "height": { "type": "number" },
            "unit": { "type": "string" }
          },
          "additionalProperties": true
        },
        "requiredChecks": {
          "type": "array",
          "items": { "type": "string" }
        },
        "handoffNotes": {
          "type": "array",
          "items": { "type": "string" }
        }
      },
      "additionalProperties": true
    },
    "qa": {
      "type": "object",
      "description": "Optional QA evidence recorded after generated deck review.",
      "properties": {
        "firstVersionVisualQa": {
          "type": "object",
          "description": "Visual QA gate for declaring the first generated PPTX version ready.",
          "properties": {
            "status": {
              "type": "string",
              "enum": ["pending", "passed", "waived"]
            },
            "evidence": {
              "oneOf": [
                { "type": "string" },
                { "type": "array", "items": { "type": "string" } }
              ],
              "description": "Path(s) or URI(s) to the final visual QA bundle. Required handoff evidence should include full-slide renders, component/group crops, a component manifest, and raw independent visual critique."
            },
            "report": { "type": "string" },
            "bundle": { "type": "string" },
            "notes": { "type": "string" },
            "reviewedBy": { "type": "string" },
            "reviewedAt": { "type": "string" }
          },
          "additionalProperties": true
        }
      },
      "additionalProperties": true
    },
    "diagrams": {
      "type": "object",
      "additionalProperties": {
        "type": "object",
        "properties": {
          "type": { "type": "string" },
          "renderer": { "type": "string" },
          "title": { "type": "string" },
          "subtitle": { "type": "string" },
          "caption": { "type": "string" },
          "steps": { "type": "array", "items": { "$ref": "#/$defs/cardItem" } },
          "items": { "type": "array", "items": { "$ref": "#/$defs/cardItem" } },
          "sources": { "type": "array", "items": { "$ref": "#/$defs/cardItem" } },
          "outputs": { "type": "array", "items": { "$ref": "#/$defs/cardItem" } },
          "guardrails": { "type": "array", "items": { "type": "string" } },
          "leftLabel": { "type": "string" },
          "rightLabel": { "type": "string" },
          "center": {
            "type": "object",
            "properties": {
              "title": { "type": "string" },
              "detail": { "type": "string" },
              "badges": { "type": "array", "items": { "type": "string" } }
            },
            "additionalProperties": true
          },
          "inputs": { "type": "array", "items": { "$ref": "#/$defs/cardItem" } },
          "outcomes": { "type": "array", "items": { "$ref": "#/$defs/cardItem" } }
        },
        "additionalProperties": true
      }
    },
    "slides": {
      "type": "array",
      "minItems": 1,
      "items": {
        "type": "object",
        "required": ["type", "title"],
        "properties": {
          "type": { "type": "string" },
          "label": { "type": "string" },
          "title": { "type": "string", "minLength": 1 },
          "headline": { "type": "string" },
          "supportingLine": { "type": "string" },
          "speakerNotes": { "type": "string" },
          "processDiagram": { "type": "string" },
          "footprintDiagram": { "type": "string" },
          "architectureDiagram": { "type": "string" },
          "ambitionDiagram": { "type": "string" },
          "guardrailLine": { "type": "string" },
          "closingLine": { "type": "string" },
          "proofArtifacts": {
            "type": "array",
            "items": {
              "type": "object",
              "required": ["label"],
              "properties": {
                "label": { "type": "string" },
                "caption": { "type": "string" },
                "accent": { "type": "string" }
              },
              "additionalProperties": true
            }
          }
        },
        "additionalProperties": true
      }
    }
  },
  "$defs": {
    "cardItem": {
      "type": "object",
      "properties": {
        "title": { "type": "string" },
        "detail": { "type": "string" },
        "code": { "type": "string" },
        "name": { "type": "string" },
        "group": { "type": "string" },
        "kind": { "type": "string" },
        "line1": { "type": "string" },
        "line2": { "type": "string" }
      },
      "additionalProperties": true
    }
  },
  "additionalProperties": true
}
